{
  "$schema": "./state.schema.json",
  "state_version": 1,
  "updated_at": "2026-09-28T00:00:00Z",
  "control": {
    "paused": true,
    "pause_reason": "Waiting for owner go: repository private, config/environments filled, delivery server ready (HUMAN_CHECKPOINTS.md)",
    "tick_minutes": 30,
    "max_workers": 6,
    "lane_cap": 2,
    "lease_ttl_hours": 4,
    "worker_max_turns": 150,
    "usd_per_estimated_hour": 6,
    "daily_budget_usd": 400,
    "release_scope": [
      "R1"
    ],
    "default_models": {
      "orchestrator": "claude-opus-5-5",
      "tier_a": "claude-opus-5-5",
      "tier_b": "claude-sonnet-5",
      "tier_c": "claude-sonnet-5",
      "reviewer": "claude-opus-5-5",
      "verifier": "claude-sonnet-5"
    }
  },
  "budget": {
    "spent_usd_total": 0,
    "spent_usd_today": 0,
    "day": "2026-09-28"
  },
  "locks": {},
  "leases": [],
  "tasks": {
    "ALC-001": {
      "status": "NOT_STARTED",
      "attempts": 0,
      "pr": null,
      "model": null,
      "steps_done": [],
      "evidence": null,
      "blocked_by": []
    },
    "ALC-002": {
      "status": "NOT_STARTED",
      "attempts": 0,
      "pr": null,
      "model": null,
      "steps_done": [],
      "evidence": null,
      "blocked_by": []
    },
    "ALC-003": {
      "status": "NOT_STARTED",
      "attempts": 0,
      "pr": null,
      "model": null,
      "steps_done": [],
      "evidence": null,
      "blocked_by": []
    },
    "ALC-004": {
      "status": "NOT_STARTED",
      "attempts": 0,
      "pr": null,
      "model": null,
      "steps_done": [],
      "evidence": null,
      "blocked_by": []
    },
    "ALC-005": {
      "status": "NOT_STARTED",
      "attempts": 0,
      "pr": null,
      "model": null,
      "steps_done": [],
      "evidence": null,
      "blocked_by": []
    },
    "ALC-006": {
      "status": "NOT_STARTED",
      "attempts": 0,
      "pr": null,
      "model": null,
      "steps_done": [],
      "evidence": null,
      "blocked_by": []
    },
    "ALC-007": {
      "status": "NOT_STARTED",
      "attempts": 0,
      "pr": null,
      "model": null,
      "steps_done": [],
      "evidence": null,
      "blocked_by": []
    },
    "ALC-008": {
      "status": "NOT_STARTED",
      "attempts": 0,
      "pr": null,
      "model": null,
      "steps_done": [],
      "evidence": null,
      "blocked_by": []
    },
    "ALC-101": {
      "status": "NOT_STARTED",
      "attempts": 0,
      "pr": null,
      "model": null,
      "steps_done": [],
      "evidence": null,
      "blocked_by": []
    },
    "ALC-102": {
      "status": "NOT_STARTED",
      "attempts": 0,
      "pr": null,
      "model": null,
      "steps_done": [],
      "evidence": null,
      "blocked_by": []
    },
    "ALC-103": {
      "status": "NOT_STARTED",
      "attempts": 0,
      "pr": null,
      "model": null,
      "steps_done": [],
      "evidence": null,
      "blocked_by": []
    },
    "ALC-104": {
      "status": "NOT_STARTED",
      "attempts": 0,
      "pr": null,
      "model": null,
      "steps_done": [],
      "evidence": null,
      "blocked_by": []
    },
    "API-001": {
      "status": "NOT_STARTED",
      "attempts": 0,
      "pr": null,
      "model": null,
      "steps_done": [],
      "evidence": null,
      "blocked_by": []
    },
    "API-002": {
      "status": "NOT_STARTED",
      "attempts": 0,
      "pr": null,
      "model": null,
      "steps_done": [],
      "evidence": null,
      "blocked_by": []
    },
    "API-003": {
      "status": "NOT_STARTED",
      "attempts": 0,
      "pr": null,
      "model": null,
      "steps_done": [],
      "evidence": null,
      "blocked_by": []
    },
    "API-004": {
      "status": "NOT_STARTED",
      "attempts": 0,
      "pr": null,
      "model": null,
      "steps_done": [],
      "evidence": null,
      "blocked_by": []
    },
    "API-005": {
      "status": "NOT_STARTED",
      "attempts": 0,
      "pr": null,
      "model": null,
      "steps_done": [],
      "evidence": null,
      "blocked_by": []
    },
    "API-006": {
      "status": "NOT_STARTED",
      "attempts": 0,
      "pr": null,
      "model": null,
      "steps_done": [],
      "evidence": null,
      "blocked_by": []
    },
    "API-101": {
      "status": "NOT_STARTED",
      "attempts": 0,
      "pr": null,
      "model": null,
      "steps_done": [],
      "evidence": null,
      "blocked_by": []
    },
    "API-102": {
      "status": "NOT_STARTED",
      "attempts": 0,
      "pr": null,
      "model": null,
      "steps_done": [],
      "evidence": null,
      "blocked_by": []
    },
    "API-104": {
      "status": "NOT_STARTED",
      "attempts": 0,
      "pr": null,
      "model": null,
      "steps_done": [],
      "evidence": null,
      "blocked_by": []
    },
    "CON-001": {
      "status": "NOT_STARTED",
      "attempts": 0,
      "pr": null,
      "model": null,
      "steps_done": [],
      "evidence": null,
      "blocked_by": []
    },
    "CON-002": {
      "status": "NOT_STARTED",
      "attempts": 0,
      "pr": null,
      "model": null,
      "steps_done": [],
      "evidence": null,
      "blocked_by": []
    },
    "CON-003": {
      "status": "NOT_STARTED",
      "attempts": 0,
      "pr": null,
      "model": null,
      "steps_done": [],
      "evidence": null,
      "blocked_by": []
    },
    "CON-004": {
      "status": "NOT_STARTED",
      "attempts": 0,
      "pr": null,
      "model": null,
      "steps_done": [],
      "evidence": null,
      "blocked_by": []
    },
    "CON-005": {
      "status": "NOT_STARTED",
      "attempts": 0,
      "pr": null,
      "model": null,
      "steps_done": [],
      "evidence": null,
      "blocked_by": []
    },
    "CON-006": {
      "status": "NOT_STARTED",
      "attempts": 0,
      "pr": null,
      "model": null,
      "steps_done": [],
      "evidence": null,
      "blocked_by": []
    },
    "CON-101": {
      "status": "NOT_STARTED",
      "attempts": 0,
      "pr": null,
      "model": null,
      "steps_done": [],
      "evidence": null,
      "blocked_by": []
    },
    "CON-102": {
      "status": "NOT_STARTED",
      "attempts": 0,
      "pr": null,
      "model": null,
      "steps_done": [],
      "evidence": null,
      "blocked_by": []
    },
    "CON-103": {
      "status": "NOT_STARTED",
      "attempts": 0,
      "pr": null,
      "model": null,
      "steps_done": [],
      "evidence": null,
      "blocked_by": []
    },
    "CTL-001": {
      "status": "NOT_STARTED",
      "attempts": 0,
      "pr": null,
      "model": null,
      "steps_done": [],
      "evidence": null,
      "blocked_by": []
    },
    "CTL-002": {
      "status": "NOT_STARTED",
      "attempts": 0,
      "pr": null,
      "model": null,
      "steps_done": [],
      "evidence": null,
      "blocked_by": []
    },
    "CTL-003": {
      "status": "NOT_STARTED",
      "attempts": 0,
      "pr": null,
      "model": null,
      "steps_done": [],
      "evidence": null,
      "blocked_by": []
    },
    "CTL-004": {
      "status": "NOT_STARTED",
      "attempts": 0,
      "pr": null,
      "model": null,
      "steps_done": [],
      "evidence": null,
      "blocked_by": []
    },
    "CTL-005": {
      "status": "NOT_STARTED",
      "attempts": 0,
      "pr": null,
      "model": null,
      "steps_done": [],
      "evidence": null,
      "blocked_by": []
    },
    "CTL-006": {
      "status": "NOT_STARTED",
      "attempts": 0,
      "pr": null,
      "model": null,
      "steps_done": [],
      "evidence": null,
      "blocked_by": []
    },
    "CTL-007": {
      "status": "NOT_STARTED",
      "attempts": 0,
      "pr": null,
      "model": null,
      "steps_done": [],
      "evidence": null,
      "blocked_by": []
    },
    "CTL-101": {
      "status": "NOT_STARTED",
      "attempts": 0,
      "pr": null,
      "model": null,
      "steps_done": [],
      "evidence": null,
      "blocked_by": []
    },
    "CTL-102": {
      "status": "NOT_STARTED",
      "attempts": 0,
      "pr": null,
      "model": null,
      "steps_done": [],
      "evidence": null,
      "blocked_by": []
    },
    "CTL-103": {
      "status": "MERGED_INTO:UX-101",
      "attempts": 0,
      "pr": null,
      "model": null,
      "steps_done": [],
      "evidence": null,
      "blocked_by": []
    },
    "DBT-001": {
      "status": "NOT_STARTED",
      "attempts": 0,
      "pr": null,
      "model": null,
      "steps_done": [],
      "evidence": null,
      "blocked_by": []
    },
    "DBT-002": {
      "status": "NOT_STARTED",
      "attempts": 0,
      "pr": null,
      "model": null,
      "steps_done": [],
      "evidence": null,
      "blocked_by": []
    },
    "DBT-003": {
      "status": "NOT_STARTED",
      "attempts": 0,
      "pr": null,
      "model": null,
      "steps_done": [],
      "evidence": null,
      "blocked_by": []
    },
    "DBT-004": {
      "status": "NOT_STARTED",
      "attempts": 0,
      "pr": null,
      "model": null,
      "steps_done": [],
      "evidence": null,
      "blocked_by": []
    },
    "DBT-005": {
      "status": "NOT_STARTED",
      "attempts": 0,
      "pr": null,
      "model": null,
      "steps_done": [],
      "evidence": null,
      "blocked_by": []
    },
    "DBT-006": {
      "status": "NOT_STARTED",
      "attempts": 0,
      "pr": null,
      "model": null,
      "steps_done": [],
      "evidence": null,
      "blocked_by": []
    },
    "DBT-101": {
      "status": "NOT_STARTED",
      "attempts": 0,
      "pr": null,
      "model": null,
      "steps_done": [],
      "evidence": null,
      "blocked_by": []
    },
    "DBT-102": {
      "status": "NOT_STARTED",
      "attempts": 0,
      "pr": null,
      "model": null,
      "steps_done": [],
      "evidence": null,
      "blocked_by": []
    },
    "DBT-103": {
      "status": "NOT_STARTED",
      "attempts": 0,
      "pr": null,
      "model": null,
      "steps_done": [],
      "evidence": null,